sudo tcpdump -n -i enX0
tcpdump: verbose output suppressed, use -v[v]... for full protocol decode
listening on enX0, link-type EN10MB (Ethernet), snapshot length 262144 bytes
22:17:33.483985 IP 172.31.24.43.22 > 99.231.186.139.56753: Flags [P.], seq 3429016712:3429016820, ack 1743049253, win 935, length 108
22:17:33.484067 IP 172.31.24.43.22 > 99.231.186.139.56753: Flags [P.], seq 108:144, ack 1, win 935, length 36
22:17:33.484123 IP 172.31.24.43.22 > 99.231.186.139.56753: Flags [P.], seq 144:196, ack 1, win 935, length 52
22:17:33.484186 IP 172.31.24.43.22 > 99.231.186.139.56753: Flags [P.], seq 196:264, ack 1, win 935, length 68
22:17:33.484245 IP 172.31.24.43.22 > 99.231.186.139.56753: Flags [P.], seq 264:332, ack 1, win 935, length 68
22:17:33.484296 IP 172.31.24.43.22 > 99.231.186.139.56753: Flags [P.], seq 332:368, ack 1, win 935, length 36
22:17:33.493894 IP 99.231.186.139.56753 > 172.31.24.43.22: Flags [P.], seq 1:37, ack 4294967244, win 8187, length 36
22:17:33.493949 IP 172.31.24.43.22 > 99.231.186.139.56753: Flags [P.], seq 368:404, ack 37, win 935, length 36
22:17:33.520024 IP 99.231.186.139.56753 > 172.31.24.43.22: Flags [P.], seq 37:73, ack 0, win 8187, length 36
22:17:33.520097 IP 172.31.24.43.22 > 99.231.186.139.56753: Flags [P.], seq 404:440, ack 73, win 935, length 36
22:17:33.531195 IP 99.231.186.139.56753 > 172.31.24.43.22: Flags [.], ack 144, win 8186, length 0
22:17:33.531195 IP 99.231.186.139.56753 > 172.31.24.43.22: Flags [.], ack 264, win 8191, length 0
22:17:33.531195 IP 99.231.186.139.56753 > 172.31.24.43.22: Flags [.], ack 368, win 8191, length 0
22:17:33.552575 IP 99.231.186.139.56753 > 172.31.24.43.22: Flags [P.], seq 73:109, ack 404, win 8191, length 36
22:17:33.552665 IP 172.31.24.43.22 > 99.231.186.139.56753: Flags [P.], seq 440:476, ack 109, win 935, length 36
22:17:33.585199 IP 172.31.24.43.22 > 99.231.186.139.56753: Flags [P.], seq 476:648, ack 109, win 935, length 172
22:17:33.585284 IP 172.31.24.43.22 > 99.231.186.139.56753: Flags [P.], seq 648:684, ack 109, win 935, length 36
